original,normalized
2 ăn được nhìu món á,2 ăn được nhiều món á
2 vc 3 đứa con cp mỗi tháng tầm 30 40tr,2 vợ chồng 3 đứa con chi phí mỗi tháng tầm 30 40 triệu
711 còn bao nhiêu món t bao hết t cần ăn một mình,711 còn bao nhiêu món tôi bao hết tôi cần ăn một mình
Balo k khác gì bãi rác,Balo không khác gì bãi rác
Bây giờ qtr là bé sống với ai sẽ tốt hơn,Bây giờ quá trời là bé sống với ai sẽ tốt hơn
Chac tuong dc luong 10tr de lam ha gi t luong 8tr nha,Chắc tưởng được lương 10 triệu dễ lắm ha gì tôi lương 8 triệu nha
Cho lên phường cmn đi,Cho lên phường con mẹ nó đi
Chuyện bình thường cả cô dâu chú rể đều đi xuất khẩu lao động xa nhà mua đc vé máy bay 2 chiều về nước tổ chức đám cưới cực khổ lắm chứ,Chuyện bình thường cả cô dâu chú rể đều đi xuất khẩu lao động xa nhà mua được vé máy bay 2 chiều về nước tổ chức đám cưới cực khổ lắm chứ
Chắc thầy lại thích xem món chym nướng rồi,Chắc thầy lại thích xem món chim nướng rồi
Chắc tưởng đc lương 10tr dễ lắm ha gì t lương 8tr nha,Chắc tưởng được lương 10 triệu dễ lắm ha gì tôi lương 8 triệu nha
Chứ vấn đề nó ko nằm ở ăn đc thịt mỡ hay k,Chứ vấn đề nó không nằm ở ăn được thịt mỡ hay không
Ck em kiểu sự tiến bộ vượt bậc Tâng cân không kiểm soát,Chồng em kiểu sự tiến bộ vượt bậc tăng cân không kiểm soát
Coi chừng hết hè dô gặp thích lại,Coi chừng hết hè vô gặp thích lại
Con cái khoẻ mạnh ko lo tính gì thật chứ ốm đau bệnh tật thì nhức óc thật nhiều lúc ước mình độc thân,Con cái khoẻ mạnh không lo tính gì thật chứ ốm đau bệnh tật thì nhức óc thật nhiều lúc ước mình độc thân
Con mèo nhà tôi ngồi nghe tôi tâm sự 7749 lần về chiện khum thể thức sớm đi làm vì tối lỡ cày truyện tới 3h sáng,Con mèo nhà tôi ngồi nghe tôi tâm sự 7749 lần về chuyện không thể thức sớm đi làm vì tối lỡ cày truyện tới 3 giờ sáng
Con t lớp 4 đi học về và chiến lợi phẩm đây,Con tôi lớp 4 đi học về và chiến lợi phẩm đây
Cá biển cá sông cá gai cá k gai cá gai bự cá k gai k bự cá có vảy cá da trơn,Cá biển cá sông cá gai cá không gai cá gai bự cá không gai không bự cá có vảy cá da trơn
Câu chuyện này nếu k phải để giật tít thì quá ý nghĩa,Câu chuyện này nếu không phải để giật tít thì quá ý nghĩa
Còn hơn nhiều t 1 đồng k muốn bỏ,Còn hơn nhiều thằng 1 đồng không muốn bỏ
Có biến gì hong dẫy,Có biến gì không vậy
Có khi qua đó học thêm tiếng Trung r lại đc mời làm diễn viên lại phất phim ảnh bên đó idol đc buff mạnh gấp tỉ lần Việt Nam đóng phim vẫn nhạt nhưng hơn đi hát,Có khi qua đó học thêm tiếng Trung rồi lại được mời làm diễn viên lại phất phim ảnh bên đó idol được buff mạnh gấp tỉ lần Việt Nam đóng phim vẫn nhạt nhưng hơn đi hát
Có vk hết rồi mà nói gì zị tr,Có vợ hết rồi mà nói gì vậy trời
Có điều ngta cứ chửi t tính như này sau này lấy ck ngta chửi cho,Có điều ngta cứ chửi tôi tính như này sau này lấy chồng người ta chửi cho
Cũng trong hôm nay HLV đội nam Pencak Silat của Indo cũng đã bị mời ra khỏi nhà thi đấu sau hành vi ném biển quảng cáo khi các VĐV của Indo và Malay đang thi đấu Lúc này VĐV Indo đang thua,Cũng trong hôm nay Huấn Luyện Viên đội nam Pencak Silat của Indo cũng đã bị mời ra khỏi nhà thi đấu sau hành vi ném biển quảng cáo khi các Vận Động Viên của Indo và Malay đang thi đấu Lúc này vận động viên Indo đang thua
Cả nhà iu ơi assignments có khó thì đã có 𝐁𝐁𝐂 𝐀𝐬𝐬𝐢𝐠𝐧𝐦𝐞𝐧𝐭𝐬 lo nhé,cả nhà yêu ơi assignments có khó thì đã có BBC Assignments lo nhé
Cứ nghĩ thế là yêu thương con mình lắm à cháu còn bé k biết gì đã đành ông làm bố r nhận thức kém hơn cả nó,Cứ nghĩ thế là yêu thương con mình lắm à cháu còn bé không biết gì đã đành ông làm bố rồi nhận thức kém hơn cả nó
Dẫu biết là cv của a nhìu,Dẫu biết là công việc của anh nhiều
Dễ bạn gái a quyết lắm,Dễ bạn gái anh quyết lắm
Em gái bị đánh kia mà ko rút đơn chắc cũng nhanh mà tầm 2 năm thôi,Em gái bị đánh kia mà không rút đơn chắc cũng nhanh mà tầm 2 năm thôi
Em sẽ học đc cách thảo mai với đồng nghiệp,Em sẽ học được cách thảo mai với đồng nghiệp
Gia đình dui dẻ bên con guột,Gia đình vui vẻ bên con ruột
Gánh team khoản này so với 3 ng kia luôn,Gánh team khoản này so với 3 người kia luôn
Gì dị trùi tự nhiên khóc,Gì vậy trời tự nhiên khóc
Hnay giành hcv nữa thì có thêm tấm chồng yêu thương,Hôm nay giành huy chương vàng nữa thì có thêm tấm chồng yêu thương
Hên quá k phải ấp hội thạnh,Hên quá không phải ấp hội thạnh
Hỏng có nói dậy đi,Không có nói vậy đi
Im im đừng ns gì hết,Im im đừng nói gì hết
Khum biết nữa nhưng ý vậy như cảm giác người lớn tuổi không thể lãng mạn kiểu tuổi trẻ vậy,Không biết nữa nhưng ý vậy như cảm giác người lớn tuổi không thể lãng mạn kiểu tuổi trẻ vậy
Kiểu mở miệng là thấy ngại ngại sao k bíc làm cách nào khéo nữa,Kiểu mở miệng là thấy ngại ngại sao không biết làm cách nào khéo nữa
Ko cho vay thì ngại cho vay oy tới lúc đòi thì sợ giận mà ko đòi ngta cg ko có suy nghĩ muốn trả mà kb lm tn,Không cho vay thì ngại cho vay rồi tới lúc đòi thì sợ giận mà không đòi người ta cũng không có suy nghĩ muốn trả mà kb làm tn
Lm ác quỷ thì có j là sai vậy ạ,Làm ác quỷ thì có gì là sai vậy ạ
Lop tre gio qua gioi kiem 500 700tr thang la binh thuong va qua nhieu nguoi kiem dc nhu the chu ko phai truong hop ca biet dau,Lớp trẻ giờ quá giỏi kiếm 500 700 triệu tháng là bình thường và quá nhiều người kiếm được như thế chứ không phải trường hợp cá biệt đâu
Lương t 10tr cần tìm ck lương tháng 90tr cho tròn 100,Lương tôi 10 triệu cần tìm chồng lương tháng 90 triệu cho tròn 100
Lớp trẻ giờ quá giỏi kiếm 500 700tr tháng là bình thường và quá nhiều người kiếm dc như thế chứ ko phải trường hợp cá biệt đâu,Lớp trẻ giờ quá giỏi kiếm 500 700 triệu tháng là bình thường và quá nhiều người kiếm được như thế chứ không phải trường hợp cá biệt đâu
May ghê t hướng nội nhưng k có tiền cho ng ta vay,May ghê tôi hướng nội nhưng không có tiền cho người ta vay
Minh luong hon 10tr cu the la 10tr200 the nao van lay dc vo,Mình lương hơn 10 triệu cụ thể là 10 triệu 200 ngàn thể nào vẫn lấy được vợ
Mk da kiem duoc 100tr dau tien nho viec boc phet ntn,Mình đã kiếm được 100 triệu đầu tiên nhờ việc bốc phét như thế này
Mk đã kiếm được 100tr đầu tiên nhờ việc bốc phét ntn,Mình đã kiếm được 100 triệu đầu tiên nhờ việc bốc phét như thế này
Mua C4G chắc là vừa có tiền vừa có quyền ròi,Mua C4G chắc là vừa có tiền vừa có quyền rồi
Má tao bị mẹ tao chửi quài luôn á mẹ mày đi lấy tiền ngta chứ tao kiu mày đi mượn hay đi xin ngta đâu mà mày k đám đi khók x100 lần,Má tao bị mẹ tao chửi hoài luôn á mẹ mày đi lấy tiền người ta chứ tao kêu mày đi mượn hay đi xin người ta đâu mà mày không đám đi khóc x100 lần
Mình cũng k ăn thịt mỡ và ăn gà thì bỏ da nhưng có any hỗ trợ khi ăn chung là lấy phần mỡ và da gà ra cho mình nếu any k lấy thì nghỉ ăn 1 bữa thịt cũng đc mà còn nhiều món khác sao lại bới như vậy,Mình cũng không ăn thịt mỡ và ăn gà thì bỏ da nhưng có anh người yêu hỗ trợ khi ăn chung là lấy phần mỡ và da gà ra cho mình nếu anh người yêu không lấy thì nghỉ ăn 1 bữa thịt cũng được mà còn nhiều món khác sao lại bới như vậy
Mình lương hơn 10tr cụ thể là 10tr200 thể nào vẫn lấy đc vợ,Mình lương hơn 10 triệu cụ thể là 10 triệu 200 ngàn thể nào vẫn lấy được vợ
Mõi lần có khách tui thấy quán kéo cửa lại chi zậy chị,Mỗi lần có khách tui thấy quán kéo cửa lại chi vậy chị
Mẹ iu order đuy,Mẹ yêu order đi
Mẹ ơi con muốn 1 anh ny như này mình muốn có 1 ng để kể lể mọi chuyện ý nghe thôi cũng được thỉnh thoảng nói vài câu là đẹp r,Mẹ ơi con muốn 1 anh người yêu như này mình muốn có 1 người để kể lể mọi chuyện ấy nghe thôi cũng được thỉnh thoảng nói vài câu là đẹp rồi
Một chút ngọt ngào cho sáng t2 toàn cớt à,Một chút ngọt ngào cho sáng thứ 2 toàn cứt à
Ng hướng nội kiểu mừng cưới bạn 1 củ sau bao năm mình mời bạn đếch đi và r có nhiều ng mừng lại 5 trăm ta nói cạn cmnl,Người hướng nội kiểu mừng cưới bạn 1 củ sau bao năm mình mời bạn đếch đi và rồi có nhiều người mừng lại 5 trăm ta nói cạn con mẹ nó lời
Nghèo đâu nghèo ngta eat clean mà,Nghèo đâu nghèo người ta eat clean mà
Nguoi tot luong 10tr tim duoc nguoi hop luong 8tr la dac,Người tốt lương 10 triệu tìm được người hợp lương 8tr là đắt
Nhìn giống ck iu Trần Hiểu quá z,Nhìn giống chồng yêu Trần Hiểu quá vậy
Nhưng có thể gắp nguyên cục và bỏ mỡ ra ít nhất cũng k gây phản cảm,Nhưng có thể gắp nguyên cục và bỏ mỡ ra ít nhất cũng không gây phản cảm
Nhưng nếu k mi nhon thì k phải cái váy nào cũng mặc được,Nhưng nếu không mi nhon thì không phải cái váy nào cũng mặc được
Nó xịt càng cay càng tức nên càng phải cố túm bằng đc,Nó xịt càng cay càng tức nên càng phải cố túm bằng được
Nội hàm càng cao càng độc đáo ko đại trà,Nội hàm càng cao càng độc đáo không đại trà
Quá nước nát hết r,Quá nước nát hết rồi
R có khi tiền ck mình làm ra b k biết ntn nó lại đem cho gái,Rồi có khi tiền chồng mình làm ra bạn không biết như thế này nó lại đem cho gái
Rõ là nguồn gốc trung quốc thây kêu k rõ xuất xứ,Rõ là nguồn gốc trung quốc thấy kêu không rõ xuất xứ
Rất giỏi mỗi tội nghèo thời gian tập luyện lấy ngay thằng ck giàu là ngon hơn đi thi đấu rồi,Rất giỏi mỗi tội nghèo thời gian tập luyện lấy ngay thằng chồng giàu là ngon hơn đi thi đấu rồi
Rồi đổi đời bất ngờ thì thấy có rồi đó mà hổng có dzui lắm,Rồi đổi đời bất ngờ thì thấy có rồi đó mà không có vui lắm
Sau rút kinh nghiệm nhà ng yêu sau ăn gì cũng đừng bới ngó kĩ hãy gắp chưa cưới còn đc lựa chọn ng này ng kia chứ cưới rồi chỉ có ngậm bồ hòn,Sau rút kinh nghiệm nhà người yêu sau ăn gì cũng đừng bới ngó kĩ hãy gắp chưa cưới còn được lựa chọn người này người kia chứ cưới rồi chỉ có ngậm bồ hòn
Sau đó bạn quay lại chửi ngta đã đem mưa đến cuộc đời bạn,Sau đó bạn quay lại chửi người ta đã đem mưa đến cuộc đời bạn
Sạch thiệt nhưng tốn quá jo bỏ khỏi dùng luôn,Sạch thiệt nhưng tốn quá giờ bỏ khỏi dùng luôn
T có 2 con rồi nhưng thi thoảng t vẫn tự hỏi ko biết sau này t già rồi t còn thích ăn bimbim uống tsua nữa ko,Tôi có 2 con rồi nhưng thi thoảng tôi vẫn tự hỏi không biết sau này tôi già rồi tôi còn thích ăn bimbim uống trà sữa nữa không
Tao đã dặn kĩ rồi mà mày đang làm clgt,Tao đã dặn kỹ rồi mà mày đang làm cái lồn gì thế
Thôi mà trời ơi ai mượn nhắc chi z,Thôi mà trời ơi ai mượn nhắc chi vậy
Thôi thì cứ nằm mấy chỗ đắt tiền thêm cái giấy chứng thương kèm theo tinh thần hoảng loạn sợ gặp người lạ nữa thì nhà thằng kia k đến quỳ xuống xin tha,Thôi thì cứ nằm mấy chỗ đắt tiền thêm cái giấy chứng thương kèm theo tinh thần hoảng loạn sợ gặp người lạ nữa thì nhà thằng kia không đến quỳ xuống xin tha
Thật ra mấy bài như này là để nhắc tụi mày mai là t2,Thật ra mấy bài như này là để nhắc tụi mày mai là thứ 2
Thế lương 20tr có lấy được vợ nữa ko ad,Thế lương 20tr có lấy được vợ nữa không ad
Thế nào đc 9.5 thật đó đỉnh vãi ò đã v mk điểm cao nhất lớp chứ đc cô thưởng 300k,Thế nào được 9.5 thật đó đỉnh vãi ò đã vậy mình điểm cao nhất lớp chứ được cô thưởng 300 ngàn
Trvia mình đang đi chậm nên ko có bị xây xát gì nhiều chỉ có ở đầu gối tay vs cằm,Trộm vía mình đang đi chậm nên không có bị xây xát gì nhiều chỉ có ở đầu gối tay với cằm
Trước t cũng zậy nghỉ xong cười quá trời tháng sau tiền thì hết việc chưa kiếm đc rồi lại khóc,Trước tôi cũng vậy nghỉ xong cười quá trời tháng sau tiền thì hết việc chưa kiếm được rồi lại khóc
Trường X là trường gì v ạ để e bít e né,Trường X là trường gì vậy ạ để em biết em né
Tương lai của em ck mình,Tương lai của em chồng mình
Tưởng nó vay 500k nma nó vay 50tr nên chịu,Tưởng nó vay 500 ngàn nhưng mà nó vay 50 triệu nên chịu
Vd là ck méo thương vk nhé,Ví dụ là chồng đéo thương vợ nhé
Xong mai cả lũ chó đến quỳ lạy ngta cũng kiện để cho ngồi nhà đá bóc lịch,Xong mai cả lũ chó đến quỳ lạy người ta cũng kiện để cho ngồi nhà đá bóc lịch
Xuống nằm cười khà khà chung cho dui đi nè cả nhà ơiii,Xuống nằm cười khà khà chung cho vui đi nè cả nhà ơi
anh ngủ thêm đi em đi lấy ck,anh ngủ thêm đi em đi lấy chồng
bao h nghỉ thì hú,bao giờ nghỉ thì hú
bv noi toi khong duoc do xe do,bảo vệ nói tôi không được đỗ xe đó
bà Nghê xinh vậy mà t thấy k bằng bà ChiPu luôn chời,bà Nghê xinh vậy mà tôi thấy không bằng bà ChiPu luôn trời
bình tĩnh ny của t đang học mẫu giáo,bình tĩnh người yêu của tôi đang học mẫu giáo
bạn mình bị rồi nhờ CA thì phải chung nhìu tiền,bạn mình bị rồi nhờ công an thì phải chung nhiều tiền
cho e vay 500tr ik,cho em vay 500 triệu đi
chắc cty bé nên chưa thấy sự chuyên nghiệp trong cách làm vc,chắc công ty bé nên chưa thấy sự chuyên nghiệp trong cách làm việc
chờ anh dep trai nhất xuất hiện,chờ anh đẹp trai nhất xuất hiện
con dâu t mà bới vậy t cũng chửi,con dâu tôi mà bới vậy tôi cũng chửi
các b cứ yên tâm bộ ngoại giao thì phản đối chứ bộ quốc phòng thì vẫn sẵn sàng nói chung là tầm vài năm nữa TQ nó hoàn thiện rồi trao trả lại cho mình mình đỡ đc bao nhiêu việc,các bạn cứ yên tâm bộ ngoại giao thì phản đối chứ bộ quốc phòng thì vẫn sẵn sàng nói chung là tầm vài năm nữa Trung Quốc nó hoàn thiện rồi trao trả lại cho mình mình đỡ được bao nhiêu việc
cái trường hợp ni quen quá nhễ,cái trường hợp này quen quá nhỉ
còn 1 kiểu nữa là ko có tóc đó,còn 1 kiểu nữa là không có tóc đó
cũng có thể nha mấy shop bán hàng đi ngày 1k đơn 2 ngày mỗi lần cod về 400 500tr ko ak,cũng có thể nha mấy shop bán hàng đi ngày 1 ngàn đơn 2 ngày mỗi lần cod về 400 500 triệu không à
cứ ngây thơ thế thoai,cứ ngây thơ thế thôi
dzề nhà cẩn thận nha,về nhà cẩn thận nha
dạo này mình mơi dạy khó khăn hơn mình nghĩ và cũng thấy khá là thú vị có 55k thôi nhưng cũng dc ròi,dạo này mình mới dạy khó khăn hơn mình nghĩ và cũng thấy khá là thú vị có 55 ngàn thôi nhưng cũng được rồi
e muốn ăn bnhieu cũng được,em muốn ăn bao nhiêu cũng được
em mình thích chụp ở mấy store hiệu cho trông giàu k,em mình thích chụp ở mấy store hiệu cho trông giàu không
giả bộ cười trong đth,giả bộ cười trong điện thoại
hãy bt tận hưởng đi,hãy biết tận hưởng đi
hôm qua làm theo rồi thơm mùi bánh mỳ đem chiên giòn chấm tương ớt nhứt nách,hôm qua làm theo rồi thơm mùi bánh mì đem chiên giòn chấm tương ớt nhức nách
hẹn hò hem bạn ơi,hẹn hò không bạn ơi
i hệt giọng hát hqua,y hệt giọng hát hôm qua
k nói đâu chỉ lẳng lặng làm r qtam những thứ nhỏ nhặt nhất,không nói đâu chỉ lẳng lặng làm rồi quan tâm những thứ nhỏ nhặt nhất
ko cần xem cũng đoán 3 người còn lại gánh hơi nặng,không cần xem cũng đoán 3 người còn lại gánh hơi nặng
ko ăn thì cắn mỡ ra là được,không ăn thì cắn mỡ ra là được
lay vo thoi nhung dung sinh con 20tr hay nghi dem viec do,lấy vợ thôi nhưng đừng sinh con 20 triệu hãy nghĩ đến việc đó
lấy vợ thôi nhưng đừng sinh con 20tr hãy nghĩ đem việc đó,lấy vợ thôi nhưng đừng sinh con 20 triệu hãy nghĩ đến việc đó
lớn rồi nha có chơi có chịu nha nha kg khóc lóc à,lớn rồi nha có chơi có chịu nha nha không khóc lóc à
lỡ pé là kon dế mèn phiu lưu ký ank có thưn emk hok,lỡ bé là con dế mèn phiêu lưu ký anh có thương em không
m về đi để t sang nhà,mày về đi để tao sang nhà
m đấy chứ không ai cả,mình đấy chứ không ai cả
má tới công chiện zới t,má tới công chuyện với tôi
má ơi nhìn ác ghê hông tạo ngạc nhiên cũng ít có ác ghê,má ơi nhìn ác ghê không tạo ngạc nhiên cũng ít có ác ghê
mình chả biết phải làm gì trong trường hợp này ngoài đổ lên đầu chồng cả công nhận bạn cứng và lúy trúy thật ý,mình chả biết phải làm gì trong trường hợp này ngoài đổ lên đầu chồng cả công nhận bạn cứng và lý trý thật ý
mấy thằng HP bị đá đểu ăn hoa cải thay cơm đ biết nhục còn lấy làm vinh hạnh hở tí là ra cái vẻ giang hồ cơ,mấy thằng Hải Phòng bị đá đểu ăn hoa cải thay cơm đéo biết nhục còn lấy làm vinh hạnh hở tí là ra cái vẻ giang hồ cơ
mẹ xin lỗi tại mồm mẹ đau ko ăn đc cơm nên lỡ uống vụng của con 1 hộp sữa bột pha sẵn,mẹ xin lỗi tại mồm mẹ đau không ăn được cơm nên lỡ uống vụng của con 1 hộp sữa bột pha sẵn
mốt cột chó với cá vầy đc nè mẹ,mốt cột chó với cá vậy được nè mẹ
mới vô ca còn đỡ chứ gần về mà vô thì chỉ có nước khók,mới vô ca còn đỡ chứ gần về mà vô thì chỉ có nước khóc
ng ta nuôi con chuột này thật mà,người ta nuôi con chuột này thật mà
nghe nói mỗi ng cho e cây vàng còn được,nghe nói mỗi người cho em cây vàng còn được
ngyeu nhà ngta ko khiến tui thất vọng,người yêu nhà người ta không khiến tui thất vọng
nhà t hồi xưa có mấy túi hàng hiệu kiểu này,nhà tôi hồi xưa có mấy túi hàng hiệu kiểu này
nhức đầu dữ vậy trùi,nhức đầu dữ vậy trời
này thì đêm phia rảnh hảng sắp đi học lại nhé,này thì đêm khuya rảnh háng sắp đi học lại nhé
phải làm sai mới hấp dẫn chứ b,phải làm sai mới hấp dẫn chứ bạn
r cái cặp thành cái thùng rác luôn,rồi cái cặp thành cái thùng rác luôn
ra truong di lam chay content ngay 5 10 cai deadline dc tra 200k xong cham nuoc mat bang cai bang luong trung binh thap nhat 30tr 1 thang cua nhan vien ngan hang,ra trường đi làm chạy content ngày 5 10 cái deadline được trả 200 ngàn xong chấm nước mắt bằng cái bảng lương trung bình thấp nhất 30 triệu 1 tháng của nhân viên ngân hàng
ra trường đi làm chạy content ngày 5 10 cái deadline đc trả 200k xong chấm nước mắt bằng cái bảng lương trung bình thấp nhất 30tr 1 tháng của nhân viên ngân hàng,ra trường đi làm chạy content ngày 5 10 cái deadline được trả 200 ngàn xong chấm nước mắt bằng cái bảng lương trung bình thấp nhất 30 triệu 1 tháng của nhân viên ngân hàng
riết rồi hong mún nói lun,riết rồi hông muốn nói luôn
rồi lương tháng này của em đc 1 chẹo,rồi lương tháng này của em được 1 triệu
sao mn mỉa mai ác thế,sao mọi người mỉa mai ác thế
sao mà bà gia nghê đẹp dữ v tr đó giờ k để ý nhưng mà nhìn post này dính bả liền,sao mà bà gia nghê đẹp dữ vậy trời đó giờ không để ý nhưng mà nhìn post này dính bả liền
t cx muốn nuôi capybara,tôi cũng muốn nuôi capybara
t thì chả muốn giành giựt bao h,tôi thì chả muốn giành giật bao giờ
tam tai thái tuế của gà với mãng cầu r,tam tai thái tuế của gà với mãng cầu rồi
toi da dan anh ay kcj duoc quen,tôi đã dặn anh ấy không có gì được quên
trời ơi bây ơi cứu tau,trời ơi bây ơi cứu tao
tâm lí cứng nhma nhắn là rep,tâm lí cứng nhưng mà nhắn là rep
tâm lí tội phạm đây r,tâm lí tội phạm đây rồi
tín hiệu vũ trụ nèk,tín hiệu vũ trụ nè
tại nó không yêu mày đó chứ cung đ nào chả như nhao,tại nó không yêu mày đó chứ cung đéo nào chả như nhau
tối dìa làm z cho e đi,tối về làm vậy cho em đi
tụi mày chứ kh ai hết,tụi mày chứ không ai hết
tự nhin nghĩ đến e,tự nhiên nghĩ đến em
vào nạp triết zô đầu đi bn,vào nạp triết vô đầu đi bạn
vì các em chưa ăn dc chua,vì các em chưa ăn được chưa
vô đó ai cx nói chiện được trong khi bthg cậy mồm cx ko nói,vô đó ai cũng nói chuyện được trong khi bình thường cạy mồm cũng không nói
xin một vai dv quần chúng thôi cũng được òii,xin một vai diễn viên quần chúng thôi cũng được rồi
z anh mua dthoai mới cho em nha,vậy anh mua điện thoại mới cho em nha
Ê k khóc được làm thế nào má,Ê không khóc được làm thế nào má
á chĩu với cái sự dễ thương này,á xỉu với cái sự dễ thương này
ăn v dc nè,ăn vậy được nè
Đang iu đuơng bthf hạnh phúc tuởng tuợng mộr ngày nào đó bồ nói bận ko về chôi vs mình đc xong phát hiện bồ đi vs ngkhax,Đang yêu đương bình thường hạnh phúc tưởng tượng một ngày nào đó bồ nói bận không về chơi với mình được xong phát hiện bồ đi với người khác
Đánh nta được cái thì oai,Đánh người ta được cái thì oai
Đây là thang máy của OP đồ ắc quy,Đây là thang máy của OP đồ ác quỷ
Đổi trắng thay đen v,Đổi trắng thay đen vậy
đc hai hôm nóng quá thế là con cờ hó nhà e vào nhà tắm nằm úp bụng ngủ chắc nó cũng nóng lắm,được hai hôm nóng quá thế là con chó nhà em vào nhà tắm nằm úp bụng ngủ chắc nó cũng nóng lắm
đem cậu út Luân ra test ko,đem cậu út Luân ra test không
đã quê rồi đám bạn còn up lên mxh cho chúng cười,đã quê rồi đám bạn còn up lên mạng xã hội cho chúng cười
đạm có sữa đặc này khum dị,đạm có sữa đặc này không vậy
đằng này ko có 1 tý kiến thức nào luôn,đằng này không có 1 tí kiến thức nào luôn
đọc i cho đỡ stress pé,đọc đi cho đỡ stress bé
ở riêg chưa các e,ở riêng chưa các em
Ủa alo bất công quá,Ủa alo bất công quá
